Topic,Title,Words,Pictures,Faces
0,"Nagyobb csoportok: táborban, Keletinél, tüntetésen, fronton",katonai csata ág rendőrség bűncselekmény háború gyülekezik tömeg tömegjelenet választási ,3113,1082
1,"Kisebb csoportok: egyéni portrék: menekültek, média személyiségek, vallási vezetők",zene tömegjelenet portré teljesítmény film arckifejezés vallás vezető színész egészségügyi,857,537
2,"Úton: vonat, busz, hajó, gyalog",baleset jármű út közlekedés utca város autós akció ipar,1103,116
3,"Kisebb csoportok: családok, egyének, menekültek, politikusok, fegyveres testületek tagjai",portré gyermek fiú férfi lány család arckifejezés boldogság oktatás együttlét,1133,527
4,"Egyéni portrék, kis csoportok: politikusok, véleményformálók, ismert emberek",adminisztráció vezető politikus választási szék portré találkozás pénzügy ház földrajz,1814,1572
5,"Adatok: táblázatok, térképek, grafikonok, screenshotok, rajzok, illusztrációk",szemléltetés jel tapéta vektor szöveges papír tervezés szimbólum adat vízszintes vonal,1089,0
6,"Átkelés: kerítésnél, határon, tengeren",utazási táj természet víztömeg környezet menny közlekedés nyári vonat napfény jármű,1221,89
